{
  "schema_id": "loyalty-radar-public-report/v1",
  "publication": {
    "policy": "public",
    "product": {
      "name": "Loyalty Radar",
      "version": "0.1.2"
    },
    "generated_at": "2026-07-17T19:31:27.009002+00:00",
    "audited_at": "2026-07-17T19:36:51+00:00",
    "mode": "weekly",
    "focus": "all",
    "hours": 336,
    "future_watch_days": 60,
    "timezone": "UTC",
    "source_packs": [
      "core",
      "industry",
      "forums-global",
      "forums-cn"
    ],
    "locales": [
      "en",
      "zh-CN"
    ],
    "event_count": 40
  },
  "items": [
    {
      "event_id": "905d78c9168a4f",
      "lane": "c-end",
      "priority": "P1",
      "localized": {
        "en": {
          "title": "Register an AA business account and get 25k AA miles for free! [Update: DEAD, all previously issued miles have also been clawbacked]",
          "summary": "American Airlines · Clawback. Metrics: 25,000 Miles / 25k AA miles. Published 2026-07-11; 2 public sources.",
          "why_it_matters": "Taxonomy: Airline; ecosystem signal: Operational reliability."
        },
        "zh-CN": {
          "title": "注册AA商业账号，白拿25k AA里程！【更新：DEAD，之前发的里程也都给clawback了】",
          "summary": "American Airlines · 权益追回。指标：25,000 Miles / 25k AA miles。发布于 2026-07-11，共 2 个公开来源。",
          "why_it_matters": "分类：航空；生态信号：运营可靠性。"
        }
      },
      "source_refs": [
        {
          "source_id": "us-credit-card-guide",
          "source": "美国信用卡指南",
          "source_type": "rss",
          "url": "https://www.uscreditcardguide.com/zhuceaashangyezhanghaobaina25k-aalicheng/",
          "published_at": "2026-07-11T13:07:23+00:00"
        },
        {
          "source_id": "doctor-of-credit-cards",
          "source": "Doctor of Credit - Credit Cards",
          "source_type": "rss",
          "url": "https://www.doctorofcredit.com/aadvantage-business-loyalty-account-get-10000-miles-for-joining-code-bns10k/",
          "published_at": "2026-07-10T16:55:24+00:00"
        }
      ],
      "published_at": "2026-07-11T13:07:23+00:00",
      "future_event_dates": [
        "2026-07-31"
      ],
      "taxonomy": {
        "programs": [
          "American Airlines"
        ],
        "card_families": [],
        "topic_type": "clawback",
        "verticals": [
          "airline"
        ],
        "ecosystem_signal_types": [
          "operational_reliability"
        ],
        "stakeholders": [
          "member"
        ],
        "consumer_impact": "需避坑",
        "impact_horizon": "today"
      },
      "confidence_label": "多源证实",
      "risk_label": "可能 clawback",
      "action_label": "高风险勿操作",
      "metric_snippets": [
        "25,000 Miles",
        "25k AA miles"
      ]
    },
    {
      "event_id": "4f150cc50017bd",
      "lane": "c-end",
      "priority": "P1",
      "localized": {
        "en": {
          "title": "Rove Adds Qantas Frequent Flyer as 20th Transfer Partner + a 50% Transfer Bonus",
          "summary": "Qantas · Transfer bonus. Metrics: 50% / 1,000 Rove Miles / 1,500 Qantas Points / 1,500 miles. Published 2026-07-15; 1 public source.",
          "why_it_matters": "Taxonomy: Airline; ecosystem signal: Partner contract shift."
        },
        "zh-CN": {
          "title": "Rove 将澳洲航空飞行常客添加为第 20 位转点伙伴 + 50% 转点奖励",
          "summary": "Qantas · 转点奖励。指标：50% / 1,000 Rove Miles / 1,500 Qantas Points / 1,500 miles。发布于 2026-07-15，共 1 个公开来源。",
          "why_it_matters": "分类：航空；生态信号：合作关系变化。"
        }
      },
      "source_refs": [
        {
          "source_id": "milestalk",
          "source": "MilesTalk",
          "source_type": "rss",
          "url": "https://milestalk.com/rove-adds-qantas-frequent-flyer-as-20th-transfer-partner-a-50-transfer-bonus/",
          "published_at": "2026-07-15T10:00:44+00:00"
        }
      ],
      "published_at": "2026-07-15T10:00:44+00:00",
      "future_event_dates": [
        "2026-08-14"
      ],
      "taxonomy": {
        "programs": [
          "Qantas"
        ],
        "card_families": [],
        "topic_type": "transfer_bonus",
        "verticals": [
          "airline"
        ],
        "ecosystem_signal_types": [
          "partner_contract_shift"
        ],
        "stakeholders": [
          "member"
        ],
        "consumer_impact": "直接可用",
        "impact_horizon": "next_60_days"
      },
      "confidence_label": "博客整理",
      "risk_label": "正常权益",
      "action_label": "可直接用",
      "metric_snippets": [
        "50%",
        "1,000 Rove Miles",
        "1,500 Qantas Points",
        "1,500 miles"
      ]
    },
    {
      "event_id": "67a28503c26cfe",
      "lane": "c-end",
      "priority": "P1",
      "localized": {
        "en": {
          "title": "Link Marriott Bonvoy® & JAL Mileage Bank Account-Receive FLY ON Points & Status Match",
          "summary": "Marriott / Japan Airlines / oneworld · Status match. Metrics: 3:1 / 5,000 bonus miles / 60,000 points / 60K Marriott points. Published 2026-07-14; 4 public sources.",
          "why_it_matters": "Taxonomy: Hotel / Airline; ecosystem signal: Partner contract shift."
        },
        "zh-CN": {
          "title": "关联万豪旅享家 (Marriott Bonvoy®) 和日航里程银行账户 - 接收 FLY ON 积分和状态匹配",
          "summary": "Marriott / Japan Airlines / oneworld · 会籍匹配。指标：3:1 / 5,000 bonus miles / 60,000 points / 60K Marriott points。发布于 2026-07-14，共 4 个公开来源。",
          "why_it_matters": "分类：酒店 / 航空；生态信号：合作关系变化。"
        }
      },
      "source_refs": [
        {
          "source_id": "ft-marriott",
          "source": "FlyerTalk - Marriott Bonvoy",
          "source_type": "rss",
          "url": "https://www.flyertalk.com/forum/marriott-marriott-bonvoy/2220668-link-marriott-bonvoy-jal-mileage-bank-account-receive-fly-points-status-match.html",
          "published_at": "2026-07-14T04:59:25+00:00"
        },
        {
          "source_id": "prince-of-travel",
          "source": "Prince of Travel",
          "source_type": "rss",
          "url": "https://princeoftravel.com/news/marriott-bonvoy-japan-airlines-preferred-partnership/",
          "published_at": "2026-07-14T14:49:25+00:00"
        },
        {
          "source_id": "milestalk",
          "source": "MilesTalk",
          "source_type": "rss",
          "url": "https://milestalk.com/marriott-jal-partnership-can-mean-instant-oneworld-status/",
          "published_at": "2026-07-14T19:44:31+00:00"
        },
        {
          "source_id": "frequent-miler",
          "source": "Frequent Miler",
          "source_type": "rss",
          "url": "https://frequentmiler.com/marriott-japan-airlines-launch-deeper-partnership-earn-bonus-points-get-status-match-earn-status-points-more/",
          "published_at": "2026-07-15T17:45:33+00:00"
        }
      ],
      "published_at": "2026-07-14T04:59:25+00:00",
      "future_event_dates": [],
      "taxonomy": {
        "programs": [
          "Marriott",
          "Japan Airlines",
          "oneworld"
        ],
        "card_families": [],
        "topic_type": "status_match",
        "verticals": [
          "hotel",
          "airline"
        ],
        "ecosystem_signal_types": [
          "partner_contract_shift"
        ],
        "stakeholders": [
          "issuer",
          "member"
        ],
        "consumer_impact": "直接可用",
        "impact_horizon": "this_week"
      },
      "confidence_label": "多源证实",
      "risk_label": "正常权益",
      "action_label": "可直接用",
      "metric_snippets": [
        "3:1",
        "5,000 bonus miles",
        "60,000 points",
        "60K Marriott points"
      ]
    },
    {
      "event_id": "35d3754c650d52",
      "lane": "ecosystem",
      "priority": "P1",
      "localized": {
        "en": {
          "title": "Marriott points devaluation according to OMAAT",
          "summary": "Marriott · Devaluation. Metrics: 5% / 10%. Published 2026-07-13; 2 public sources.",
          "why_it_matters": "Taxonomy: Hotel; ecosystem signal: Devaluation or inflation."
        },
        "zh-CN": {
          "title": "根据 OMAAT 的规定，万豪积分贬值",
          "summary": "Marriott · 积分贬值。指标：5% / 10%。发布于 2026-07-13，共 2 个公开来源。",
          "why_it_matters": "分类：酒店；生态信号：积分贬值或通胀。"
        }
      },
      "source_refs": [
        {
          "source_id": "ft-marriott",
          "source": "FlyerTalk - Marriott Bonvoy",
          "source_type": "rss",
          "url": "https://www.flyertalk.com/forum/marriott-marriott-bonvoy/2220630-marriott-points-devaluation-according-omaat.html",
          "published_at": "2026-07-13T16:57:23+00:00"
        },
        {
          "source_id": "frequent-miler",
          "source": "Frequent Miler",
          "source_type": "rss",
          "url": "https://frequentmiler.com/marriott-reportedly-devalued-awards-at-some-properties-but-is-that-really-the-case/",
          "published_at": "2026-07-15T21:45:11+00:00"
        }
      ],
      "published_at": "2026-07-13T16:57:23+00:00",
      "future_event_dates": [],
      "taxonomy": {
        "programs": [
          "Marriott"
        ],
        "card_families": [],
        "topic_type": "devaluation",
        "verticals": [
          "hotel"
        ],
        "ecosystem_signal_types": [
          "devaluation_or_inflation"
        ],
        "stakeholders": [
          "member"
        ],
        "consumer_impact": "可能贬值",
        "impact_horizon": "watchlist"
      },
      "confidence_label": "多源证实",
      "risk_label": "正常权益",
      "action_label": "只观察",
      "metric_snippets": [
        "5%",
        "10%"
      ]
    },
    {
      "event_id": "ab2a31e15da6f9",
      "lane": "ecosystem",
      "priority": "P1",
      "localized": {
        "en": {
          "title": "World of Hyatt and Aeroplan Launch New Partnership: Benefits and Poor-Value Redemptions",
          "summary": "Hyatt / Air Canada · Industry signal. Metrics: 25,000 Aeroplan points / 75,000 Aeroplan points / 50,000 Hyatt points. Published 2026-07-16; 3 public sources.",